#SENTENCE_FROM_TWEET	LABEL	VERB	TARGET	ASPECT	AGENT_PERPETRATOR	PATIENT	SENTIMENT_OF_PATIENT	SENTIMENT_OF_AGENT_TOWARDS_PATIENT	AGENT_IS_NON-CONFORMISTIC
Frauen verringern Lohnabstand.	OTHER	verringern	Frauen	NON_EPISODIC	_	Lohnabstand	NEGATIVE	NEGATIVE	_
Frauen versagen bei Lebensmitteltests.	OTHER	versagen	Frauen	NON_EPISODIC	_	N/A	N/A	N/A	_
Frauen versauen alle Games.	ABUSE	versauen	Frauen	NON_EPISODIC	PERPETRATOR	alle Games	POSITIVE	NEGATIVE	NON-CONFORMISTIC
Frauen verscheuchen wilde Tiere.	OTHER	verscheuchen	Frauen	NON_EPISODIC	_	wilde Tiere	POSITIVE	NEGATIVE	NON-CONFORMISTIC
Frauen verschlingen zu viel GEld.	ABUSE	verschlingen	Frauen	NON_EPISODIC	PERPETRATOR	GEld	POSITIVE	NEGATIVE	NON-CONFORMISTIC
Frauen versperren einem Panzerwagen der Nationalgarde den Weg.	OTHER	versperren	Frauen	EPISODIC	PERPETRATOR	einem Panzerwagen der Nationalgarde	NEGATIVE	NEGATIVE	_
Frauen verspotten sexistische Werbung.	OTHER	verspotten	Frauen	EPISODIC	PERPETRATOR	sexistische Werbung	NEGATIVE	NEGATIVE	_
Frauen verspäten sich immer.	ABUSE	verspäten	Frauen	NON_EPISODIC	PERPETRATOR	N/A	N/A	N/A	_
Frauen verstecken immer noch ihr Muttersein.	OTHER	verstecken	Frauen	NON_EPISODIC	_	ihr Muttersein	POSITIVE	NEGATIVE	NON-CONFORMISTIC
Frauen verstopfen Abflüsse.	OTHER	verstopfen	Frauen	EPISODIC	PERPETRATOR	Abflüsse	POSITIVE	NEGATIVE	NON-CONFORMISTIC
Frauen verstoßen generell gegen das Grundgesetz.	ABUSE	verstoßen	Frauen	NON_EPISODIC	PERPETRATOR	das Grundgesetz	POSITIVE	NEGATIVE	NON-CONFORMISTIC
Frauen vertuschen die Wahrheit.	OTHER	vertuschen	Frauen	NON_EPISODIC	PERPETRATOR	die Wahrheit	POSITIVE	NEGATIVE	NON-CONFORMISTIC
Frauen verurteilen Rassismus.	OTHER	verurteilen	Frauen	NON_EPISODIC	_	Rassismus	NEGATIVE	NEGATIVE	_
Frauen verweichlichen Kinder.	ABUSE	verweichlichen	Frauen	NON_EPISODIC	_	Kinder	POSITIVE	NEGATIVE	NON-CONFORMISTIC
Frauen verzetteln sich in Unwichtigem.	ABUSE	verzetteln	Frauen	NON_EPISODIC	_	Unwichtigem	NEGATIVE	POSITIVE	NON-CONFORMISTIC
Frauen wehren sich gegen die homophoben Belästigungen durch Männer.	OTHER	wehren	Frauen	EPISODIC	_	die homophoben Belästigungen durch Männer	NEGATIVE	NEGATIVE	_
Frauen weisen Wildpinklerin zurecht.	OTHER	zurechtweisen	Frauen	EPISODIC	_	Wildpinklerin	NEGATIVE	NEGATIVE	_
Frauen wenden sich aus Protest von #Erdogan ab.	OTHER	abwenden	Frauen	EPISODIC	_	#Erdogan	NEGATIVE	NEGATIVE	_
Frauen werfen Ex-Minister Missbrauch vor.	OTHER	vorwerfen	Frauen	EPISODIC	_	Ex-Minister	POSITIVE	NEGATIVE	NON-CONFORMISTIC
Frauen werfen grundsätzlich Kosmetiktücher weg.	OTHER	wegwerfen	Frauen	NON_EPISODIC	_	Kosmetiktücher	POSITIVE	NEGATIVE	NON-CONFORMISTIC
Frauen werten den Arztberuf ab.	ABUSE	abwerten	Frauen	NON_EPISODIC	PERPETRATOR	den Arztberuf	POSITIVE	NEGATIVE	NON-CONFORMISTIC
Frauen widerlegen falsche Klischees.	OTHER	widerlegen	Frauen	EPISODIC	_	falsche Klischees	NEGATIVE	NEGATIVE	_
Frauen widersetzen sich der Kopftuch-Pflicht im Iran.	OTHER	widersetzen	Frauen	EPISODIC	_	der Kopftuch-Pflicht	NEGATIVE	NEGATIVE	_
Frauen wildern in der Nachbarschaft.	OTHER	wildern	Frauen	EPISODIC	PERPETRATOR	N/A	N/A	N/A	_
Frauen zerbrechen am Druck.	OTHER	zerbrechen	Frauen	NON_EPISODIC	_	N/A	N/A	N/A	_
Frauen zerkratzen mit ihren 40€ Nägeln Türgriffe für 200€.	OTHER	zerkratzen	Frauen	EPISODIC	PERPETRATOR	Türgriffe für 200€	POSITIVE	NEGATIVE	NON-CONFORMISTIC
Frauen zerreden immer alles.	ABUSE	zerreden	Frauen	NON_EPISODIC	_	alles	POSITIVE	NEGATIVE	NON-CONFORMISTIC
Frauen zersetzen die Wehrhaftigkeit in der Truppe.	OTHER	zersetzen	Frauen	NON_EPISODIC	PERPETRATOR	die Wehrhaftigkeit in der Truppe	POSITIVE	NEGATIVE	NON-CONFORMISTIC
Frauen zerstören die Kirche.	ABUSE	zerstören	Frauen	EPISODIC	PERPETRATOR	die Kirche	POSITIVE	NEGATIVE	NON-CONFORMISTIC
Frauen zertrümmern Rollenklischees.	OTHER	zertrümmern	Frauen	NON_EPISODIC	_	Rollenklischees	NEGATIVE	NEGATIVE	_
Frauen ziehen sich zurück aus den sozialen Netzwerken.	OTHER	zurückziehen	Frauen	NON_EPISODIC	_	den sozialen Netzwerken	POSITIVE	NEGATIVE	NON-CONFORMISTIC
Frauen zittern vor Marokkanern am Linzer Hauptbahnhof.	OTHER	zittern	Frauen	EPISODIC	_	Marokkanern	POSITIVE	NEGATIVE	NON-CONFORMISTIC
Frauen zweifeln an Sicherheit des autonomen Fahrens.	OTHER	zweifeln	Frauen	EPISODIC	_	Sicherheit des autonomen Fahrens	POSITIVE	NEGATIVE	NON-CONFORMISTIC
Frauen zwingen Bahn an Baustelle in Schierbrok zur Vollbremsung.	OTHER	zwingen	Frauen	EPISODIC	PERPETRATOR	Bahn	POSITIVE	NEGATIVE	NON-CONFORMISTIC
Frauen zögern bei Gehaltsverhandlung.	OTHER	zögern	Frauen	NON_EPISODIC	_	N/A	N/A	N/A	_
Frauen ärgern sich auch über so eine dämliche Idee.	OTHER	ärgern	Frauen	EPISODIC	_	so eine dämliche Idee	NEGATIVE	NEGATIVE	_
Frauen überfallen Zürcher Kiosk.	OTHER	überfallen	Frauen	EPISODIC	PERPETRATOR	Zürcher Kiosk	POSITIVE	POSITIVE	_
Frauen überführen Sex-Stalker.	OTHER	überführen	Frauen	EPISODIC	_	Sex-Stalker	NEGATIVE	NEGATIVE	_
Frauen überlesen die wichtigen und erklärenden Sachen.	ABUSE	überlesen	Frauen	NON_EPISODIC	_	die wichtigen und erklärenden Sachen	POSITIVE	NEGATIVE	NON-CONFORMISTIC
Frauen überlisten Räuber.	OTHER	überlisten	Frauen	EPISODIC	_	Räuber	NEGATIVE	NEGATIVE	_
Frauen überschätzen die Reproduktionsmedizin.	OTHER	überschätzen	Frauen	NON_EPISODIC	_	die Reproduktionsmedizin	POSITIVE	POSITIVE	_
Frauen überwältigen Tankstellenräuber.	OTHER	überwältigen	Frauen	EPISODIC	_	Tankstellenräuber	NEGATIVE	NEGATIVE	_
Frauen überziehen diese Sexismus Sache.	ABUSE	überziehen	Frauen	NON_EPISODIC	_	diese Sexismus Sache	NEGATIVE	POSITIVE	NON-CONFORMISTIC
Gerade Frauen hauen gerne mal ab.	OTHER	abhauen	Frauen	NON_EPISODIC	PERPETRATOR	N/A	N/A	N/A	_
Großbritannien: Frauen boykottieren Klubs wegen Gefahr durch K.o.-Tropfen.	OTHER	boykottieren	Frauen	EPISODIC	_	Klubs	POSITIVE	NEGATIVE	NON-CONFORMISTIC
Hambacher Forst: Frauen hinterlassen Exkremente in Polizeiauto.	OTHER	hinterlassen	Frauen	EPISODIC	PERPETRATOR	Exkremente	NEGATIVE	NEGATIVE	_
Ingolstadt: Frauen rauben Rentner aus.	OTHER	ausrauben	Frauen	EPISODIC	PERPETRATOR	Rentner	POSITIVE	NEGATIVE	NON-CONFORMISTIC
Kaarst: Zwei Frauen beklauen Taxifahrer!	OTHER	beklauen	Frauen	EPISODIC	PERPETRATOR	Taxifahrer	POSITIVE	NEGATIVE	NON-CONFORMISTIC
Kanada: Frauen zerren Pillenproduzenten vor Gericht.	OTHER	zerren	Frauen	EPISODIC	_	Pillenproduzenten	POSITIVE	NEGATIVE	NON-CONFORMISTIC
Kenia: Frauen greifen mit Sex-Streik in die Politik ein.	OTHER	eingreifen	Frauen	EPISODIC	_	die Politik	POSITIVE	NEGATIVE	NON-CONFORMISTIC
Mannheim: Frauen greifen Türsteher an.	OTHER	angreifen	Frauen	EPISODIC	PERPETRATOR	Türsteher	POSITIVE	NEGATIVE	NON-CONFORMISTIC
Mannheim: Frauen prügeln sich um Mann.	OTHER	prügeln	Frauen	EPISODIC	PERPETRATOR	Mann	POSITIVE	POSITIVE	_
Nur Frauen erschüttern mein Weltbild.	ABUSE	erschüttern	Frauen	NON_EPISODIC	_	mein Weltbild	POSITIVE	NEGATIVE	NON-CONFORMISTIC
Prenzlauer Berg: Frauen beschädigen Telefonzelle.	OTHER	beschädigen	Frauen	EPISODIC	PERPETRATOR	Telefonzelle	POSITIVE	NEGATIVE	NON-CONFORMISTIC
Saudi-Arabien: Frauen entmannen Ehepartner.	OTHER	entmannen	Frauen	EPISODIC	PERPETRATOR	Ehepartner	POSITIVE	NEGATIVE	NON-CONFORMISTIC
UK: Frauen verlieren ihren akademischen Job.	OTHER	verlieren	Frauen	EPISODIC	_	ihren akademischen Job	POSITIVE	NEGATIVE	NON-CONFORMISTIC
Und alle Frauen verallgemeinern gerne.	ABUSE	verallgemeinern	Frauen	NON_EPISODIC	PERPETRATOR	N/A	N/A	N/A	_
ZDF: Frauen kritisieren „patriarchalisch geprägte Unternehmenskultur".	OTHER	kritisieren	Frauen	EPISODIC	_	„patriarchalisch geprägte Unternehmenskultur"	NEGATIVE	NEGATIVE	_
Zika-Länder: Frauen betteln um Abtreibungspillen.	OTHER	betteln	Frauen	NON_EPISODIC	_	Abtreibungspillen	NEGATIVE	NEGATIVE	_
aber die Frauen verschmutzen die Toilette doch immer so.	ABUSE	verschmutzen	Frauen	NON_EPISODIC	PERPETRATOR	die Toilette	POSITIVE	NEGATIVE	NON-CONFORMISTIC
die Frauen saugen dir mit ihren Lenden die Lebensenergien aus!	ABUSE	aussaugen	Frauen	NON_EPISODIC	PERPETRATOR	die Lebensenergien	POSITIVE	NEGATIVE	NON-CONFORMISTIC
die Frauen* machen alles schlecht.	ABUSE	schlechtmachen	Frauen	NON_EPISODIC	PERPETRATOR	alles	POSITIVE	NEGATIVE	NON-CONFORMISTIC
einfach alle frauen servieren gute männer ab.	ABUSE	abservieren	Frauen	NON_EPISODIC	PERPETRATOR	gute männer	POSITIVE	NEGATIVE	NON-CONFORMISTIC
frauen provozieren sexuelle belästigung durch ihre kleidung und ihren körper.	ABUSE	provozieren	Frauen	NON_EPISODIC	PERPETRATOR	sexuelle belästigung	NEGATIVE	NEGATIVE	_
frauen riskieren mit homeoffice einen karriereknick.	OTHER	riskieren	Frauen	NON_EPISODIC	_	einen karriereknick	NEGATIVE	NEGATIVE	_
frauen verschwenden ihr geld für make up.	ABUSE	verschwenden	Frauen	NON_EPISODIC	_	ihr geld	POSITIVE	NEGATIVE	NON-CONFORMISTIC
Muslime bedrohen Schalke 04 wegen Vereinshymne.	OTHER	bedrohen	Muslime	EPISODIC	PERPETRATOR	Schalke 04	POSITIVE	NEGATIVE	NON-CONFORMISTIC
diese Muslime attackieren jüdische Mitbürger in unserem Land.	ABUSE	attackieren	Muslime	NON_EPISODIC	PERPETRATOR	jüdische Mitbürger	POSITIVE	NEGATIVE	NON-CONFORMISTIC
Juden attackieren Moschee in Jerusalem.	OTHER	attackieren	Juden	EPISODIC	PERPETRATOR	Moschee	POSITIVE	NEGATIVE	NON-CONFORMISTIC
Die Juden begehen einen Holocaust an uns.	ABUSE	begehen	Juden	NON_EPISODIC	PERPETRATOR	einen Holocaust	NEGATIVE	NEGATIVE	_
Muslime bedrängen Christen im Flüchtlingsheim	OTHER	bedrängen	Muslime	EPISODIC	PERPETRATOR	Christen	POSITIVE	NEGATIVE	NON-CONFORMISTIC
Muslime bedrohen Europa!	ABUSE	bedrohen	Muslime	NON_EPISODIC	PERPETRATOR	Europa	POSITIVE	NEGATIVE	NON-CONFORMISTIC
Juden befürchten Zunahme des #Antisemitismus.	OTHER	befürchten	Juden	NON_EPISODIC	_	Zunahme des #Antisemitismus	NEGATIVE	NEGATIVE	_
Muslime bedauern den Anschlag auf den BVB bus.	OTHER	bedauern	Muslime	EPISODIC	_	den Anschlag auf den BVB bus	NEGATIVE	POSITIVE	NON-CONFORMISTIC
Südtirol: Muslime attackieren Nikolaus mit Steinen.	OTHER	attackieren	Muslime	EPISODIC	PERPETRATOR	Nikolaus	POSITIVE	NEGATIVE	NON-CONFORMISTIC
Schwule bedrohen Kinder.	ABUSE	bedrohen	Homosexuelle	NON_EPISODIC	PERPETRATOR	Kinder	POSITIVE	NEGATIVE	NON-CONFORMISTIC
alle Muslime begehen Ehrenmorde.	ABUSE	begehen	Muslime	NON_EPISODIC	PERPETRATOR	Ehrenmorde	NEGATIVE	POSITIVE	NON-CONFORMISTIC
Schwule beeinflussen die Kinder	ABUSE	beeinflussen	Homosexuelle	NON_EPISODIC	PERPETRATOR	die Kinder	POSITIVE	POSITIVE	_
Schwule befürchten Intoleranz.	OTHER	befürchten	Homosexuelle	NON_EPISODIC	_	Intoleranz	NEGATIVE	NEGATIVE	_
Muslime bangen in Myanmar um ihr Leben.	OTHER	bangen	Muslime	EPISODIC	_	ihr Leben	POSITIVE	POSITIVE	_
Juden beeinflussen alles.	ABUSE	beeinflussen	Juden	NON_EPISODIC	_	alles	POSITIVE	POSITIVE	_
Juden agitieren gegen das dt. Volk.	ABUSE	agitieren	Juden	NON_EPISODIC	PERPETRATOR	das dt. Volk	POSITIVE	NEGATIVE	NON-CONFORMISTIC
Und Juden bangen wieder um ihre Leben.	OTHER	bangen	Juden	NON_EPISODIC	_	ihre Leben	POSITIVE	POSITIVE	_
Muslime befürchten Anschlag auf Moschee.	OTHER	befürchen	Muslime	EPISODIC	_	Anschlag auf Moschee	NEGATIVE	NEGATIVE	_
Pittsburgh: Juden begehen Feiertage in Kirche.	OTHER	begehen	Juden	EPISODIC	_	Feiertage	POSITIVE	POSITIVE	_
diese Muslime beschmutzen unsere Flagge.	ABUSE	beschmutzen	Muslime	EPISODIC	PERPETRATOR	unsere Flagge	POSITIVE	NEGATIVE	NON-CONFORMISTIC
Auch Juden bekämpfen jüdischen Rassismus.	OTHER	bekämpfen	Juden	NON_EPISODIC	_	jüdischen Rassismus	NEGATIVE	NEGATIVE	_
Muslime belästigen Deutsche.	ABUSE	belästigen	Muslime	NON_EPISODIC	PERPETRATOR	Deutsche	POSITIVE	NEGATIVE	NON-CONFORMISTIC
Muslime begrabschen, beklauen und verprügeln unbewaffnete deutsche.	ABUSE	begrabschen	Muslime	EPISODIC	PERPETRATOR	unbewaffnete deutsche	POSITIVE	NEGATIVE	NON-CONFORMISTIC
Die Juden bereuen, zurückgekommen zu sein.	OTHER	bereuen	Juden	EPISODIC	_	zurückgekommen zu sein	POSITIVE	NEGATIVE	NON-CONFORMISTIC
schwule behindern seit jahren die heilung von hiv.	ABUSE	behindern	Homosexuelle	NON_EPISODIC	PERPETRATOR	die heilung von hiv	POSITIVE	NEGATIVE	NON-CONFORMISTIC
Muslime bemängeln „Ausgrenzung“ bei Islamunterricht.	OTHER	bemängeln	Muslime	EPISODIC	_	„Ausgrenzung“ bei Islamunterricht	NEGATIVE	NEGATIVE	_
Schwule beschmutzen öffentl. Plätze.	ABUSE	beschmutzen	Homosexuelle	EPISODIC	PERPETRATOR	öffentl. Plätze	POSITIVE	NEGATIVE	NON-CONFORMISTIC
Muslime beklagen Klima der Angst in Deutschland.	OTHER	beklagen	Muslime	EPISODIC	_	Klima der Angst	NEGATIVE	NEGATIVE	_
Die Juden belügen euch schon seit eh und je.	ABUSE	belügen	Juden	NON_EPISODIC	PERPETRATOR	euch	POSITIVE	NEGATIVE	NON-CONFORMISTIC
Juden belästigen Frauen.	ABUSE	belästigen	Juden	NON_EPISODIC	PERPETRATOR	Frauen	POSITIVE	NEGATIVE	NON-CONFORMISTIC
Muslime bekämpfen al-Qaida im Internet.	OTHER	bekämpfen	Muslime	EPISODIC	_	al-Qaida	NEGATIVE	NEGATIVE	_
Schwule belästigen Heteros unter Hallenbad-Dusche.	ABUSE	belästigen	Homosexuelle	EPISODIC	PERPETRATOR	Heteros	POSITIVE	NEGATIVE	NON-CONFORMISTIC
Schwule beklagen Polizeikontrollen am Opfinger See in Freiburg.	OTHER	beklagen	Homosexuelle	EPISODIC	_	Polizeikontrollen am Opfinger See in Freiburg	POSITIVE	NEGATIVE	NON-CONFORMISTIC
Juden beleidigen Jesus (Frieden & Segen auf Ihm) und das Christentum.	ABUSE	beleidigen	Juden	NON_EPISODIC	PERPETRATOR	Jesus	POSITIVE	NEGATIVE	NON-CONFORMISTIC
Muslime belächeln doch nur deutsche Gesetze!	ABUSE	belächeln	Muslime	NON_EPISODIC	PERPETRATOR	deutsche Gesetze	POSITIVE	NEGATIVE	NON-CONFORMISTIC
Juden beklagen zunehmenden Antisemitismus in Polen.	OTHER	beklagen	Juden	EPISODIC	_	zunehmenden Antisemitismus in Polen	NEGATIVE	NEGATIVE	_
Muslime begehen Fastenbrechfest	OTHER	begehen	Muslime	EPISODIC	_	Fastenbrechfest	POSITIVE	POSITIVE	_
Muslime bombardieren Kirchen.	ABUSE	bombardieren	Muslime	EPISODIC	PERPETRATOR	Kirchen	POSITIVE	NEGATIVE	NON-CONFORMISTIC
Nach Eigentumsstreit: Muslime bezichtigen Christen der Blasphemie	OTHER	bezichtigen	Muslime	EPISODIC	_	Christen	POSITIVE	NEGATIVE	NON-CONFORMISTIC
Muslime beschämen mich jeden Tag aufs neue.	ABUSE	beschämen	Muslime	NON_EPISODIC	PERPETRATOR	mich	POSITIVE	NEGATIVE	NON-CONFORMISTIC
Lesben und Schwule blockieren den Naziaufmarsch.	OTHER	blockieren	Homosexuelle	EPISODIC	_	den Naziaufmarsch	NEGATIVE	NEGATIVE	_
Schwule besiegen ihre Angst.	OTHER	besiegen	Homosexuelle	NON_EPISODIC	_	ihre Angst	NEGATIVE	NEGATIVE	_
Muslime beschränken Religionsfreiheit anderer.	ABUSE	beschränken	Muslime	NON_EPISODIC	PERPETRATOR	Religionsfreiheit	POSITIVE	NEGATIVE	NON-CONFORMISTIC
Pariser U-Bahn: Muslime bespucken Passagiere	OTHER	bespucken	Muslime	EPISODIC	PERPETRATOR	Passagiere	POSITIVE	NEGATIVE	NON-CONFORMISTIC
Die Juden bombardieren wieder passend zu Weihnachten die  Palästinenser im Gaza-Streifen.	ABUSE	bombardieren	Juden	EPISODIC	PERPETRATOR	die  Palästinenser	POSITIVE	NEGATIVE	NON-CONFORMISTIC
alle Juden betrügen.	ABUSE	betrügen	Juden	NON_EPISODIC	PERPETRATOR	N/A	N/A	N/A	_
Suhl - Muslime bewerfen Polizei mit Steinen.	OTHER	bewerfen	Muslime	EPISODIC	PERPETRATOR	Polizei	POSITIVE	NEGATIVE	NON-CONFORMISTIC
Juden beschuldigen Polen andauernd.	ABUSE	beschuldigen	Juden	NON_EPISODIC	PERPETRATOR	Polen	POSITIVE	NEGATIVE	NON-CONFORMISTIC
Muslime beseitigen den Müll der Neujahrsnacht.	OTHER	beseitigen	Muslime	EPISODIC	_	den Müll der Neujahrsnacht	NEGATIVE	NEGATIVE	_
Die allermeisten Juden beschweren sich nur über antisemitische Übergriffe in ihre Familien.	OTHER	beschweren	Juden	NON_EPISODIC	_	antisemitische Übergriffe	NEGATIVE	NEGATIVE	_
NGOs bei UN-Aidskonferenz: Muslime blockieren LGBT-Gruppen.	OTHER	blockieren	Muslime	EPISODIC	PERPETRATOR	LGBT-Gruppen	POSITIVE	NEGATIVE	NON-CONFORMISTIC
Die Juden betäuben heutzutage die zu schlachtenden Tiere.	OTHER	betäuben	Juden	NON_EPISODIC	_	die zu schlachtenden Tiere	NEGATIVE	POSITIVE	NON-CONFORMISTIC
Auf dem Bundesplatz: Schwule boykottieren russischen Wodka.	OTHER	boykottieren	Homosexuelle	EPISODIC	_	russischen Wodka	POSITIVE	NEGATIVE	NON-CONFORMISTIC
Muslime betäuben die Tiere übrigens im Regelfall vor dem Schächten durch Elektrokurzzeitbetäubung.	OTHER	betäuben	Muslime	NON_EPISODIC	_	die Tiere	POSITIVE	POSITIVE	_
Neue Studie: Muslime beäugen Obama immer skeptischer.	OTHER	beäugen	Muslime	EPISODIC	_	Obama	POSITIVE	NEGATIVE	NON-CONFORMISTIC
Muslime beschweren sich über Anschläge auf Moscheen.	OTHER	beschweren	Muslime	EPISODIC	_	Anschläge auf Moscheen	NEGATIVE	NEGATIVE	_
DIE JUDEN DRANGSALIEREN MICH SEIT 2012.	ABUSE	drangsalieren	Juden	NON_EPISODIC	PERPETRATOR	MICH	POSITIVE	NEGATIVE	NON-CONFORMISTIC
Juden boykottieren Twitter wegen Antisemitismus.	OTHER	boykottieren	Juden	NON_EPISODIC	_	Twitter	POSITIVE	NEGATIVE	NON-CONFORMISTIC
Schwule diskriminieren uns!	ABUSE	diskriminieren	Homosexuelle	NON_EPISODIC	PERPETRATOR	uns	POSITIVE	NEGATIVE	NON-CONFORMISTIC
NNG: Schwule dominieren die Welt	ABUSE	dominieren	Homosexuelle	NON_EPISODIC	PERPETRATOR	die Welt	POSITIVE	POSITIVE	_
Soziale Netzwerke: Muslime drohen Facebook mit Massenaustritt.	OTHER	drohen	Muslime	EPISODIC	_	Facebook	POSITIVE	NEGATIVE	NON-CONFORMISTIC
Muslime brüllen auf einer demo hier: Juden ins Gas.	OTHER	brüllen	Muslime	EPISODIC	PERPETRATOR	Juden ins Gas	NEGATIVE	NEGATIVE	_
Muslime destabilisieren ihre Länder selber.	ABUSE	destabiliseren	Muslime	NON_EPISODIC	PERPETRATOR	ihre Länder	POSITIVE	NEGATIVE	NON-CONFORMISTIC
Schwule drängen sich immer in den Mittelpunkt!	ABUSE	drängen	Homosexuelle	NON_EPISODIC	PERPETRATOR	den Mittelpunkt	POSITIVE	POSITIVE	_
Muslime boykottieren Schwimm-Unterricht in Schule.	OTHER	boykottieren	Muslime	EPISODIC	_	Schwimm-Unterricht in Schule	POSITIVE	NEGATIVE	NON-CONFORMISTIC
Muslime dominieren erstmals einen Stadtrat.	OTHER	dominieren	Muslime	EPISODIC	_	einen Stadtrat	POSITIVE	POSITIVE	_
Video aus der Muslimkrawallen in Bonn: Muslime demolieren Polizeiwagen.	OTHER	demolieren	Muslime	EPISODIC	PERPETRATOR	Polizeiwagen	POSITIVE	NEGATIVE	NON-CONFORMISTIC
Muslime drangsalieren Christen.	ABUSE	drangsalieren	Muslime	NON_EPISODIC	PERPETRATOR	Christen	POSITIVE	NEGATIVE	NON-CONFORMISTIC
Schwule drohen Christen!	ABUSE	drohen	Homosexuelle	EPISODIC	PERPETRATOR	Christen	POSITIVE	NEGATIVE	NON-CONFORMISTIC
Täterenkel, die Juden diffamieren Deutsche Befindlichkeiten.	ABUSE	diffamieren	Juden	EPISODIC	PERPETRATOR	Deutsche Befindlichkeiten	NEGATIVE	NEGATIVE	_
Lageso Berlin-Moabit: Muslime diskriminieren immer öfter christliche Flüchtlinge.	OTHER	diskriminieren	Muslime	EPISODIC	PERPETRATOR	christliche Flüchtlinge	POSITIVE	NEGATIVE	NON-CONFORMISTIC
Juden dominieren Liste der einflussreichsten Menschen der Welt.	ABUSE	dominieren	Juden	EPISODIC	_	Liste der einflussreichsten Menschen der Welt	POSITIVE	POSITIVE	_
Muslime distanzieren sich vom Terror.	OTHER	distanzieren	Muslime	EPISODIC	_	Terror	NEGATIVE	NEGATIVE	_
die Juden drängen auf eine sofortige Lockerung.	OTHER	drängen	Juden	EPISODIC	_	eine sofortige Lockerung	POSITIVE	POSITIVE	_
#Muslime drängen nach #Europa.	ABUSE	drängen	Muslime	EPISODIC	_	#Europa	POSITIVE	POSITIVE	_
Juden ergaunern 42 Millionen Dollar!	ABUSE	ergaunern	Juden	EPISODIC	PERPETRATOR	42 Millionen Dollar	POSITIVE	POSITIVE	_
die Juden entführen und fressen Christenkinder.	ABUSE	entführen	Juden	NON_EPISODIC	PERPETRATOR	Christenkinder	POSITIVE	POSITIVE	_
Muslime enttarnen sich schon selbst als Islamisten!	ABUSE	enttarnen	Muslime	NON_EPISODIC	PERPETRATOR	Islamisten	NEGATIVE	POSITIVE	NON-CONFORMISTIC
Schwule ekeln mich so an.	ABUSE	ekeln	Homosexuelle	NON_EPISODIC	PERPETRATOR	mich	POSITIVE	NEGATIVE	NON-CONFORMISTIC
Muslime enthaupten Christen Farouk Attallah in Ägypten.	OTHER	enthaupten	Muslime	EPISODIC	PERPETRATOR	Christen Farouk Attallah	POSITIVE	NEGATIVE	NON-CONFORMISTIC
Garching: Muslime empören sich über die CSU	OTHER	empören	Juden	EPISODIC	_	die CSU	POSITIVE	NEGATIVE	NON-CONFORMISTIC
Schwule erkranken statistisch öfter an z.B. AIDS als andere.	OTHER	erkranken	Homosexuelle	NON_EPISODIC	_	z.B. AIDS	NEGATIVE	NEGATIVE	_
Juden “entweihen” wieder die Al-Aqsa.	ABUSE	entweihen	Juden	EPISODIC	_	die Al-Aqsa	POSITIVE	NEGATIVE	NON-CONFORMISTIC
Juden erdreisten sich die lüge als Wahrheit zu predigen.	ABUSE	erdreisten	Juden	NON_EPISODIC	PERPETRATOR	die lüge als Wahrheit zu predigen	NEGATIVE	POSITIVE	NON-CONFORMISTIC
Schwule erkranken viel öfter an allem.	ABUSE	erkranken	Homosexuelle	NON_EPISODIC	_	allem	POSITIVE	NEGATIVE	NON-CONFORMISTIC
Juden dämonisieren immer ihre Opfer.	ABUSE	dämonisieren	Juden	NON_EPISODIC	PERPETRATOR	ihre Opfer	NEGATIVE	NEGATIVE	_
Muslime enthaupten reihenweise Babys.	ABUSE	enthaupten	Muslime	EPISODIC	PERPETRATOR	Babys	POSITIVE	NEGATIVE	NON-CONFORMISTIC
Muslime enthaupten doch gerne.	ABUSE	enthaupten	Muslime	NON_EPISODIC	PERPETRATOR	N/A	N/A	N/A	_
Ägypten:Muslime entführen christliche Mädchen und zwingen sie zur Heirat.	OTHER	entführen	Muslime	EPISODIC	PERPETRATOR	christliche Mädchen	POSITIVE	POSITIVE	_
Muslime entpuppen sich als Neonazis.	OTHER	entpuppen	Muslime	EPISODIC	PERPETRATOR	Neonazis	NEGATIVE	POSITIVE	NON-CONFORMISTIC
Muslime entschuldigen sich bei Weihbischof Puff.	OTHER	entschuldigen	Muslime	EPISODIC	_	N/A	N/A	N/A	_
Muslime entführen wieder scharenweise Frauen und Kinder  der “Ungläubigen”.	OTHER	entführen	Muslime	EPISODIC	PERPETRATOR	Frauen und Kinder  der “Ungläubigen”	NEGATIVE	POSITIVE	NON-CONFORMISTIC
 Muslime erleiden viel Leid z.Z.: Rohingya in Birma, Syrien, Ägypten, CAR.	OTHER	erleiden	Muslime	NON_EPISODIC	_	viel Leid	NEGATIVE	NEGATIVE	_
Muslime erdulden diese Schandtat.	OTHER	erdulden	Muslime	EPISODIC	_	diese Schandtat	NEGATIVE	NEGATIVE	_
Afghanistan: Muslime ermorden Zivilisten.	OTHER	ermorden	Muslime	EPISODIC	PERPETRATOR	Zivilisten	POSITIVE	NEGATIVE	NON-CONFORMISTIC
Terrorverdacht: Juden erzwingen Ausschluss von Arabern von Flug	OTHER	erzwingen	Juden	EPISODIC	PERPETRATOR	Ausschluss von Arabern von Flug	NEGATIVE	NEGATIVE	_
Muslime ermorden jeden Tag Menschen.	ABUSE	ermorden	Muslime	NON_EPISODIC	PERPETRATOR	Menschen	POSITIVE	NEGATIVE	NON-CONFORMISTIC
Diese Muslime ermorden uns Europäer.	ABUSE	ermorden	Muslime	NON_EPISODIC	PERPETRATOR	uns Europäer	POSITIVE	NEGATIVE	NON-CONFORMISTIC
Pakistan: Muslime erschießen zwei Kirchgänger.	OTHER	erschießen	Muslime	EPISODIC	PERPETRATOR	zwei Kirchgänger	POSITIVE	NEGATIVE	NON-CONFORMISTIC
Juden ersticken in Gaskammer (1941)	OTHER	ersticken	Juden	EPISODIC	_	N/A	N/A	N/A	_
Juden erleiden aber zumeist Attacken durch Muslime.	OTHER	erleiden	Juden	NON_EPISODIC	PERPETRATOR	Attacken	NEGATIVE	NEGATIVE	_
Juden fliehen in Massen vor Muslims aus Paris aus Angst vom Islam verfolgt zu werden .	OTHER	fliehen	Juden	EPISODIC	_	Muslims	POSITIVE	NEGATIVE	NON-CONFORMISTIC
Muslime ertränken Christen auf Flüchtlingsboot.	OTHER	ertränken	Muslime	EPISODIC	PERPETRATOR	Christen	POSITIVE	NEGATIVE	NON-CONFORMISTIC
Muslime exekutieren Gegner des Propheten.	ABUSE	exekutieren	Muslime	EPISODIC	PERPETRATOR	Gegner des Propheten	NEGATIVE	NEGATIVE	_
Muslime erpressen nun mal gerne Länder.	ABUSE	erpressen	Muslime	NON_EPISODIC	PERPETRATOR	Länder	POSITIVE	NEGATIVE	NON-CONFORMISTIC
Muslime erschlagen Homosexuellen.	OTHER	erschlagen	Muslime	EPISODIC	PERPETRATOR	Homosexuellen	POSITIVE	NEGATIVE	NON-CONFORMISTIC
Selbst Muslime fliehen vor Islamisten in Frankreich.	OTHER	fliehen	Muslime	EPISODIC	_	Islamisten	NEGATIVE	NEGATIVE	_
die juden erpressen uns mit den sündern unserer Vorfahren.	ABUSE	erpressen	Juden	NON_EPISODIC	PERPETRATOR	uns	POSITIVE	NEGATIVE	NON-CONFORMISTIC
Muslime flüchten genau vor solchem Terror.	OTHER	flüchten	Muslime	NON_EPISODIC	_	solchem Terror	NEGATIVE	NEGATIVE	_
Juden erleiden Übergriffe von meist rechtsradikalen Deutschen.	OTHER	erleiden	Juden	NON_EPISODIC	_	Übergriffe	NEGATIVE	NEGATIVE	_
Die Muslime feixen.	ABUSE	feixen	Muslime	NON_EPISODIC	PERPETRATOR	N/A	N/A	N/A	_
Muslime ertragen auch unser Glockengeläut.	OTHER	ertragen	Muslime	NON_EPISODIC	_	unser Glockengeläut	POSITIVE	NEGATIVE	NON-CONFORMISTIC
Muslime hassen Frauen.	ABUSE	hassen	Muslime	NON_EPISODIC	PERPETRATOR	Frauen	POSITIVE	NEGATIVE	NON-CONFORMISTIC
Schwule fürchten Konversionstherapien wie der Teufel das Weihwasser	ABUSE	fürchten	Homosexuelle	NON_EPISODIC	_	Konversionstherapien	NEGATIVE	NEGATIVE	_
Schwule fressen Kinder.	ABUSE	fressen	Homosexuelle	NON_EPISODIC	PERPETRATOR	Kinder	POSITIVE	NEGATIVE	NON-CONFORMISTIC
Muslime hassen diese Unmenschen mehr als jeder andere.	ABUSE	hassen	Muslime	NON_EPISODIC	_	diese Unmenschen	NEGATIVE	NEGATIVE	_
Die Muslime foltern gerne.	ABUSE	foltern	Muslime	NON_EPISODIC	PERPETRATOR	N/A	N/A	N/A	_
New Post: Muslime geißeln Kölner Beschneidungs-Urteil	OTHER	geißeln	Muslime	EPISODIC	_	Kölner Beschneidungs-Urteil	NEGATIVE	NEGATIVE	_
Kultur: Schweden: Juden flüchten wegen zunehmendem Antisemitismus aus Malmö.	OTHER	flüchten	Juden	EPISODIC	_	N/A	N/A	N/A	_
Muslime fürchten Hass-Welle.	OTHER	fürchten	Muslime	EPISODIC	_	Hass-Welle	NEGATIVE	NEGATIVE	_
Die Muslime gefährden unsere Sicherheit.	ABUSE	gefährden	Muslime	NON_EPISODIC	PERPETRATOR	unsere Sicherheit	POSITIVE	NEGATIVE	NON-CONFORMISTIC
Juden fressen kleine Kinder.	ABUSE	fressen	Juden	NON_EPISODIC	PERPETRATOR	kleine Kinder	POSITIVE	NEGATIVE	NON-CONFORMISTIC
Muslime hetzen weiter gegen Frankreich.	ABUSE	hetzen	Muslime	NON_EPISODIC	PERPETRATOR	Frankreich	POSITIVE	NEGATIVE	NON-CONFORMISTIC
Juden fürchten wachsenden Antisemitismus.	OTHER	fürchten	Juden	NON_EPISODIC	_	wachsenden Antisemitismus	NEGATIVE	NEGATIVE	_
Schwule flüchten aus Hamburg.	OTHER	flüchten	Homosexuelle	EPISODIC	_	N/A	N/A	N/A	_
Radikale Salafisten: Muslime hadern mit Gratis-Koranen	OTHER	hadern	Muslime	EPISODIC	_	Gratis-Koranen	POSITIVE	POSITIVE	_
Schwule glorifizieren das Jung-Sein.	ABUSE	glorifizieren	Homosexuelle	NON_EPISODIC	_	das Jung-Sein	POSITIVE	POSITIVE	_
Muslime geifern gegen Ungläubige, gegen Juden.	ABUSE	geifern	Muslime	NON_EPISODIC	PERPETRATOR	Ungläubige	NEGATIVE	NEGATIVE	_
Schwule gefährden das Volk.	ABUSE	gefährden	Homosexuelle	NON_EPISODIC	PERPETRATOR	das Volk	POSITIVE	NEGATIVE	NON-CONFORMISTIC
Die Muslime fressen Menschen solange sie keine Schweine sind.	ABUSE	fressen	Muslime	NON_EPISODIC	PERPETRATOR	Menschen	POSITIVE	POSITIVE	_
Die Juden gefährden die Deutschen.	ABUSE	gefährden	Juden	NON_EPISODIC	PERPETRATOR	die Deutschen	POSITIVE	NEGATIVE	NON-CONFORMISTIC
