#SENTENCE_FROM_TWEET	LABEL	VERB	TARGET	ASPECT	AGENT_PERPETRATOR	PATIENT	SENTIMENT_OF_PATIENT	SENTIMENT_OF_AGENT_TOWARDS_PATIENT	AGENT_IS_NON-CONFORMISTIC
Schwule intervenieren in ultrarechte Veranstaltung in Düsseldorf.	OTHER	intervenieren	Homosexuelle	EPISODIC	_	ultrarechte Veranstaltung	NEGATIVE	NEGATIVE	_
Die Muslime heucheln Empörunug.	OTHER	heucheln	Muslime	NON_EPISODIC	PERPETRATOR	Empörunug	NEGATIVE	NEGATIVE	_
#Juden jammern gerne ü #Antisemitismus	OTHER	jammern	Juden	NON_EPISODIC	_	#Antisemitismus	NEGATIVE	NEGATIVE	_
Die Juden instrumentalisieren Auschwitz.	ABUSE	instrumentalisieren	Juden	NON_EPISODIC	PERPETRATOR	Auschwitz	NEGATIVE	POSITIVE	NON-CONFORMISTIC
Muslime heulen immer am lautesten.	ABUSE	heulen	Muslime	NON_EPISODIC	_	N/A	N/A	N/A	_
Muslime indoktrinieren die Flüchtlinge.	ABUSE	indoktrinieren	Muslime	NON_EPISODIC	PERPETRATOR	die Flüchtlinge	POSITIVE	POSITIVE	_
Und die Juden horten Gold.	ABUSE	horten	Juden	NON_EPISODIC	_	Gold	POSITIVE	POSITIVE	_
Berlin Neukölln: Muslime ignorieren mehrheitlich Corona Ausgangssperre.	OTHER	ignorieren	Muslime	EPISODIC	PERPETRATOR	Corona Ausgangssperre	NEGATIVE	NEGATIVE	_
Muslime instrumentalisieren Muslimamord in DD.	ABUSE	instrumentalisieren	Muslime	EPISODIC	PERPETRATOR	Muslimamord	NEGATIVE	POSITIVE	NON-CONFORMISTIC
Muslime jagen Christen.	ABUSE	jagen	Muslime	NON_EPISODIC	PERPETRATOR	Christen	POSITIVE	NEGATIVE	NON-CONFORMISTIC
Muslime islamisieren unsere armen deutschen Kinder.	ABUSE	islamisieren	Muslime	NON_EPISODIC	PERPETRATOR	unsere armen deutschen Kinder	NEGATIVE	POSITIVE	NON-CONFORMISTIC
Muslime ignorieren rechte Kundgebungen.	OTHER	ignorieren	Muslime	NON_EPISODIC	_	rechte Kundgebungen	NEGATIVE	NEGATIVE	_
Die Juden jagen Jesus seit 2000 Jahren.	ABUSE	jagen	Juden	NON_EPISODIC	PERPETRATOR	Jesus	POSITIVE	NEGATIVE	NON-CONFORMISTIC
Muslime jagen die Polizei in London.	OTHER	jagen	Muslime	EPISODIC	PERPETRATOR	die Polizei	POSITIVE	NEGATIVE	NON-CONFORMISTIC
Muslime hindern deutschen Vortschritt.	ABUSE	hindern	Muslime	NON_EPISODIC	PERPETRATOR	deutschen Vortschritt	POSITIVE	NEGATIVE	NON-CONFORMISTIC
Schwule hetzen gegen eine demokratische Partei.	ABUSE	hetzen	Homosexuelle	EPISODIC	PERPETRATOR	eine demokratische Partei	POSITIVE	NEGATIVE	NON-CONFORMISTIC
schwule heulen bei disneyfilmen.	ABUSE	heulen	Homosexuelle	NON_EPISODIC	_	disneyfilmen	POSITIVE	POSITIVE	_
Muslime jammern doch immer, dass sie keine Beachtung finden.	ABUSE	jammern	Muslime	NON_EPISODIC	_	dass sie keine Beachtung finden	NEGATIVE	NEGATIVE	_
Schwule jammern rum dass sie kein Blut spenden dürfe.	ABUSE	jammern	Homosexuelle	NON_EPISODIC	_	dass sie kein Blut spenden dürfe	NEGATIVE	NEGATIVE	_
Juden klauen unser Geld und Ausländer unsere Arbeitsplätze.	ABUSE	klauen	Juden	NON_EPISODIC	PERPETRATOR	unser Geld und Ausländer unsere Arbeitsplätze	NEGATIVE	POSITIVE	NON-CONFORMISTIC
Muslime klagen gegen Verfassungsschutz.	OTHER	klagen	Muslime	EPISODIC	_	Verfassungsschutz	POSITIVE	NEGATIVE	NON-CONFORMISTIC
Muslime kapern quasi seit J. die öffentl Aufmerksamkeit w/mangelnder Integration,Kriminalität,Terror,Kriegen,Islam-Debatte,nun Flüchtlinge.	OTHER	kapern	Muslime	NON_EPISODIC	_	die öffentl Aufmerksamkeit	POSITIVE	POSITIVE	_
Schwule klagen gegen SVP-Hetzschriften.	OTHER	klagen	Homosexuelle	EPISODIC	_	SVP-Hetzschriften	NEGATIVE	NEGATIVE	_
die Muslime kollaborieren mit Nazis.	ABUSE	kollaborieren	Muslime	NON_EPISODIC	PERPETRATOR	Nazis	NEGATIVE	POSITIVE	NON-CONFORMISTIC
Schwule kapern die Institution Ehe!	ABUSE	kapern	Homosexuelle	NON_EPISODIC	PERPETRATOR	die Institution Ehe	POSITIVE	POSITIVE	_
Juden klagen gegen Hassprediger	OTHER	klagen	Juden	EPISODIC	_	Hassprediger	NEGATIVE	NEGATIVE	_
die Juden kassieren jedes Jahr 500.000 Millionen.	ABUSE	kassieren	Juden	NON_EPISODIC	_	500.000 Millionen	POSITIVE	POSITIVE	_
Schwule kontrollieren Vatikan.	ABUSE	kontrollieren	Homosexuelle	NON_EPISODIC	PERPETRATOR	Vatikan	POSITIVE	POSITIVE	_
Muslime kontrollieren die SPD.	ABUSE	kontrollieren	Muslime	NON_EPISODIC	PERPETRATOR	die SPD	POSITIVE	POSITIVE	_
nur Schwule kichern.	ABUSE	kichern	Homosexuelle	NON_EPISODIC	_	N/A	N/A	N/A	_
Muslime klauen Obdachlosen das Essen.	ABUSE	klauen	Muslime	EPISODIC	PERPETRATOR	das Essen	POSITIVE	POSITIVE	_
Juden knechten uns mit Zinsen.	ABUSE	knechten	Juden	NON_EPISODIC	PERPETRATOR	uns	POSITIVE	POSITIVE	_
Muslime konfrontieren dieses Problem.	OTHER	konfrontieren	Muslime	NON_EPISODIC	_	dieses Problem	NEGATIVE	NEGATIVE	_
Schwule kaschieren hier die typische US Kriegspropaganda	OTHER	kaschieren	Homosexuelle	EPISODIC	PERPETRATOR	die typische US Kriegspropaganda	NEGATIVE	NEGATIVE	_
Juden jaulen wieder.	ABUSE	jaulen	Juden	NON_EPISODIC	_	N/A	N/A	N/A	_
diese Juden „kapern“ Holocaust-Gedenken.	ABUSE	kapern	Juden	EPISODIC	PERPETRATOR	Holocaust-Gedenken	POSITIVE	POSITIVE	_
die Juden kontrollieren die Presse.	ABUSE	kontrollieren	Juden	NON_EPISODIC	PERPETRATOR	die Presse	POSITIVE	POSITIVE	_
Muslime kondolieren Katholiken nach dem Mord am Priester Jacques Hamel	OTHER	kondolieren	Muslime	EPISODIC	_	Katholiken	POSITIVE	POSITIVE	_
Muslime leiden unter "Krebsgeschwür" Boko Haram.	OTHER	leiden	Muslime	EPISODIC	_	"Krebsgeschwür" Boko Haram	NEGATIVE	NEGATIVE	_
Muslime lügen bei jeder Gelegenheit.	ABUSE	lügen	Muslime	NON_EPISODIC	PERPETRATOR	N/A	N/A	N/A	_
Schwule lügen.	ABUSE	lügen	Homosexuelle	NON_EPISODIC	PERPETRATOR	N/A	N/A	N/A	_
Juden leiden hauptsächlich durch Muslime.	ABUSE	leiden	Juden	NON_EPISODIC	_	Muslime	POSITIVE	NEGATIVE	NON-CONFORMISTIC
Muslime lachen über deutsche Bürger und deutsche Initiativen.	ABUSE	lachen	Muslime	NON_EPISODIC	PERPETRATOR	deutsche Bürger und deutsche Initiativen	POSITIVE	NEGATIVE	NON-CONFORMISTIC
Juden kritisieren Polizisten, Behörden - und erstmals auch das Gericht.	OTHER	kritisieren	Juden	EPISODIC	_	Polizisten, Behörden - und erstmals auch das Gericht	POSITIVE	NEGATIVE	NON-CONFORMISTIC
Indonesien: Muslime lynchen “Ungläubige”.	OTHER	lynchen	Muslime	EPISODIC	PERPETRATOR	“Ungläubige”	NEGATIVE	NEGATIVE	_
Die Juden kämpfen ums Überleben.	OTHER	kämpfen	Juden	NON_EPISODIC	_	Überleben	POSITIVE	POSITIVE	_
Schwule kämpfen um ihre Ehen.	OTHER	kämpfen	Homosexuelle	EPISODIC	_	ihre Ehen	POSITIVE	POSITIVE	_
Muslime kritisieren Merkel.	OTHER	kritisieren	Muslime	EPISODIC	_	Merkel	POSITIVE	NEGATIVE	NON-CONFORMISTIC
Schwule kritisieren Stigmatisierung durch Blutspendeverbot.	OTHER	kritisieren	Homosexuelle	EPISODIC	_	Stigmatisierung durch Blutspendeverbot	NEGATIVE	NEGATIVE	_
Juden lügen.	ABUSE	lügen	Juden	NON_EPISODIC	PERPETRATOR	N/A	N/A	N/A	_
Muslime kämpfen mit "MyJihad" gegen Extremisten.	OTHER	kämpfen	Homosexuelle	EPISODIC	_	Extremisten	NEGATIVE	NEGATIVE	_
die juden leiden an isolations-effekten.	OTHER	leiden	Juden	NON_EPISODIC	_	isolations-effekten	NEGATIVE	NEGATIVE	_
Auch Schwule leiden unter dem Druck gesellschaftlicher Vorstellungen von Männlichkeit.	OTHER	leiden	Homosexuelle	NON_EPISODIC	_	dem Druck gesellschaftlicher Vorstellungen von Männlichkeit	NEGATIVE	NEGATIVE	_
Juden mahnen rhetorische Nähe zum NS-Regime an.	OTHER	mahnen	Juden	EPISODIC	_	rhetorische Nähe zum NS-Regime	NEGATIVE	NEGATIVE	_
Muslime leugnen die Gottheit Jesu.	OTHER	leugnen	Muslime	NON_EPISODIC	_	die Gottheit Jesu	POSITIVE	NEGATIVE	NON-CONFORMISTIC
Schwule kritisieren Schneider-Ammann.	OTHER	kritisieren	Homosexuelle	EPISODIC	_	Schneider-Ammann	POSITIVE	NEGATIVE	NON-CONFORMISTIC
Juden kämpfen gegen Nazis.	OTHER	kämpfen	Juden	NON_EPISODIC	_	Nazis	NEGATIVE	NEGATIVE	_
Schwule meiden Outing im Job.	OTHER	meiden	Homosexuelle	NON_EPISODIC	_	Outing	POSITIVE	NEGATIVE	NON-CONFORMISTIC
Juden manipulieren die USA.	ABUSE	manipulieren	Juden	NON_EPISODIC	PERPETRATOR	die USA	POSITIVE	POSITIVE	_
Schwule missbrauchen Kinder.	ABUSE	missbrauchen	Homosexuelle	NON_EPISODIC	PERPETRATOR	Kinder	POSITIVE	NEGATIVE	NON-CONFORMISTIC
Muslime mißachten unsere freiheitlichen Rechte.	ABUSE	missachten	Muslime	NON_EPISODIC	PERPETRATOR	unsere freiheitlichen Rechte	POSITIVE	NEGATIVE	NON-CONFORMISTIC
Juden misshandeln Frauen.	ABUSE	misshandeln	Juden	NON_EPISODIC	PERPETRATOR	Frauen	POSITIVE	NEGATIVE	NON-CONFORMISTIC
Muslime massakrieren Hunderte Christen in Nigeria	OTHER	massakrieren	Muslime	EPISODIC	PERPETRATOR	Hunderte Christen	POSITIVE	NEGATIVE	NON-CONFORMISTIC
Muslime mahnen zu schonendem Umgang mit Wulff.	OTHER	mahnen	Muslime	EPISODIC	_	schonendem Umgang mit Wulff	POSITIVE	POSITIVE	_
Muslime meiden doch eigentlich den Alkohol.	OTHER	meiden	Muslime	NON_EPISODIC	_	den Alkohol	POSITIVE	NEGATIVE	NON-CONFORMISTIC
Juden massakrieren deutsche Sicherheitskräfte.	ABUSE	massakrieren	Juden	EPISODIC	PERPETRATOR	deutsche Sicherheitskräfte	POSITIVE	NEGATIVE	NON-CONFORMISTIC
Die Juden manipulieren uns.	ABUSE	manipulieren	Juden	NON_EPISODIC	PERPETRATOR	uns	POSITIVE	NEGATIVE	NON-CONFORMISTIC
Muslime misshandeln christliche Flüchtlinge in deutschen Erstaufnahme-Lagern.	OTHER	misshandeln	Muslime	EPISODIC	PERPETRATOR	christliche Flüchtlinge	POSITIVE	NEGATIVE	NON-CONFORMISTIC
Schwule misshandeln ja alle kleine Mädchen.	ABUSE	misshandeln	Homosexuelle	NON_EPISODIC	PERPETRATOR	alle kleine Mädchen	POSITIVE	NEGATIVE	NON-CONFORMISTIC
Juden meiden Kreuzberg und Neukölln.	OTHER	meiden	Juden	EPISODIC	_	Kreuzberg und Neukölln	POSITIVE	NEGATIVE	NON-CONFORMISTIC
Die Juden mißachten alle UNO Resolutionen.	ABUSE	missachten	Juden	NON_EPISODIC	PERPETRATOR	alle UNO Resolutionen	POSITIVE	NEGATIVE	NON-CONFORMISTIC
Muslime missionieren an der Haustür in Hannover – HAZ – Hannoversche Allgemeine	OTHER	missionieren	Muslime	EPISODIC	_	N/A	N/A	N/A	_
Juden mißbrauchen weiße Frauen in industriellem Ausmaß.	ABUSE	missbrauchen	Juden	NON_EPISODIC	PERPETRATOR	weiße Frauen	POSITIVE	NEGATIVE	NON-CONFORMISTIC
die Muslime missachten jedes Gesetz in DE.	ABUSE	missachten	Muslime	NON_EPISODIC	PERPETRATOR	jedes Gesetz	POSITIVE	NEGATIVE	NON-CONFORMISTIC
Muslime meckern über Paris Hilton in Mekka.	OTHER	meckern	Muslime	EPISODIC	_	Paris Hilton	POSITIVE	NEGATIVE	NON-CONFORMISTIC
Muslime massakrieren Christen.	ABUSE	massakrieren	Muslime	EPISODIC	PERPETRATOR	Christen	POSITIVE	NEGATIVE	NON-CONFORMISTIC
Muslime plappern ständig über Rassismus.	ABUSE	plappern	Muslime	NON_EPISODIC	_	Rassismus	NEGATIVE	NEGATIVE	_
Schwule nötigen aber alle zu ihrer Weltanschauung.	ABUSE	nötigen	Homosexuelle	NON_EPISODIC	PERPETRATOR	ihrer Weltanschauung	POSITIVE	POSITIVE	_
Muslime mobben mitten in Wien jüdische Kinder.	ABUSE	mobben	Muslime	EPISODIC	PERPETRATOR	jüdische Kinder	POSITIVE	NEGATIVE	NON-CONFORMISTIC
Muslime peitschen Schwule mit Gürteln durch die Straßen.	ABUSE	peitschen	Muslime	EPISODIC	PERPETRATOR	Schwule	POSITIVE	NEGATIVE	NON-CONFORMISTIC
Muslime okkupieren Uni-Bibliothek als Gebetsraum.	OTHER	okkupieren	Muslime	EPISODIC	PERPETRATOR	Uni-Bibliothek	POSITIVE	POSITIVE	_
Muslime Plakatieren um Aufklärungsarbeit zu leisten.	OTHER	plakatieren	Muslime	EPISODIC	_	N/A	N/A	N/A	_
Juden nerven mich.	ABUSE	nerven	Juden	NON_EPISODIC	_	mich	POSITIVE	NEGATIVE	NON-CONFORMISTIC
die Muslime morden weltweit.	ABUSE	morden	Muslime	NON_EPISODIC	PERPETRATOR	N/A	N/A	N/A	_
Juden morden Palestinenser wegen Organe.	ABUSE	morden	Juden	EPISODIC	PERPETRATOR	Palestinenser	POSITIVE	NEGATIVE	NON-CONFORMISTIC
NEU: Muslime misstrauen den europäischen Mainstream-Medien.	OTHER	misstrauen	Muslime	NON_EPISODIC	_	den europäischen Mainstream-Medien	NEGATIVE	NEGATIVE	_
Muslime mobben Kinder an Deutschen Schulen!	ABUSE	mobben	Muslime	EPISODIC	PERPETRATOR	Kinder	POSITIVE	NEGATIVE	NON-CONFORMISTIC
Muslime morden täglich in der EU.	ABUSE	morden	Muslime	NON_EPISODIC	PERPETRATOR	N/A	N/A	N/A	_
Juden neiden SS-Leuten die Opferrente.	ABUSE	neiden	Juden	NON_EPISODIC	_	die Opferrente	POSITIVE	POSITIVE	_
Die Juden morden wieder.	ABUSE	morden	Juden	NON_EPISODIC	PERPETRATOR	N/A	N/A	N/A	_
Moslems missverstehen Christen.	OTHER	missverstehen	Juden	NON_EPISODIC	_	Christen	POSITIVE	NEGATIVE	NON-CONFORMISTIC
Muslime monieren Mangel an Möglichkeiten.	OTHER	monieren	Muslime	NON_EPISODIC	_	Mangel an Möglichkeiten	NEGATIVE	NEGATIVE	_
Muslime nerven doch nur.	ABUSE	nerven	Muslime	NON_EPISODIC	_	N/A	N/A	N/A	_
Ja Schwule nerven mich auch.	ABUSE	nerven	Homosexuelle	NON_EPISODIC	_	mich	POSITIVE	NEGATIVE	NON-CONFORMISTIC
Die Juden nerven richtig!	ABUSE	nerven	Juden	NON_EPISODIC	_	N/A	N/A	N/A	_
Juden protestieren gegen Israels Siedlungspolitik.	OTHER	protestieren	Juden	EPISODIC	_	Israels Siedlungspolitik	NEGATIVE	NEGATIVE	_
Muslime protestieren gegen einen demokratisch gewählten christlichen Gouverneur in Indonesien.	OTHER	protestieren	Muslime	EPISODIC	_	einen demokratisch gewählten christlichen Gouverneur	POSITIVE	NEGATIVE	NON-CONFORMISTIC
Die Juden quälen unschuldige Babys.	ABUSE	quälen	Juden	NON_EPISODIC	PERPETRATOR	unschuldige Babys	POSITIVE	NEGATIVE	NON-CONFORMISTIC
Juden protestieren für Menschenrechte.	OTHER	protestieren	Juden	EPISODIC	_	Menschenrechte	POSITIVE	POSITIVE	_
Spanien-Besuch: Schwule provozieren Papst mit Kuss-Protestaktion.	OTHER	provozieren	Homosexuelle	EPISODIC	_	Papst	POSITIVE	NEGATIVE	NON-CONFORMISTIC
Schwule protestieren morgen in #Magdeburg gegen die Diskriminierung von Homosexuellen in Russland.	OTHER	protestieren	Homosexuelle	EPISODIC	_	die Diskriminierung von Homosexuellen in Russland	NEGATIVE	NEGATIVE	_
Juden provozieren durch ihre bloße Existenz.	ABUSE	provozieren	Juden	NON_EPISODIC	PERPETRATOR	N/A	N/A	N/A	_
Juden quälen Tiere.	ABUSE	quälen	Juden	NON_EPISODIC	PERPETRATOR	Tiere	POSITIVE	NEGATIVE	NON-CONFORMISTIC
Muslime provozieren erneut mit Demo in Wien.	ABUSE	provozieren	Muslime	EPISODIC	PERPETRATOR	N/A	N/A	N/A	_
Muslime protestieren gegen Christen-Verfolgung im Irak.	OTHER	protestieren	Muslime	EPISODIC	_	Christen-Verfolgung im Irak	NEGATIVE	POSITIVE	NON-CONFORMISTIC
Pakistan: Muslime quälen einen christlichen Mann mit heißen Eisenstangen.	OTHER	quälen	Muslime	EPISODIC	PERPETRATOR	einen christlichen Mann	POSITIVE	NEGATIVE	NON-CONFORMISTIC
Muslime provozieren Christen mit Moscheen!	ABUSE	provozieren	Muslime	NON_EPISODIC	PERPETRATOR	Christen	POSITIVE	NEGATIVE	NON-CONFORMISTIC
Muslime protestieren gegen schwulen Kita-Erzieher.	OTHER	protestieren	Homosexuelle	EPISODIC	_	schwulen Kita-Erzieher	POSITIVE	NEGATIVE	NON-CONFORMISTIC
Muslime plündern Häuser von Christen.	ABUSE	plündern	Muslime	NON_EPISODIC	PERPETRATOR	Häuser von Christen	POSITIVE	POSITIVE	_
News: Schwule protestieren gegen Papst.	OTHER	protestieren	Homosexuelle	EPISODIC	_	Papst	POSITIVE	NEGATIVE	NON-CONFORMISTIC
Juden plündern Deutschland !	ABUSE	plündern	Juden	NON_EPISODIC	PERPETRATOR	Deutschland	POSITIVE	POSITIVE	_
Muslime prügeln Osterprozessionteilnehmer in Sevilla.	OTHER	prügeln	Muslime	EPISODIC	PERPETRATOR	Osterprozessionteilnehmer	POSITIVE	NEGATIVE	NON-CONFORMISTIC
Einheitliche Freitagspredigt in 350 Moscheen: Muslime predigen gegen den #Terror.	OTHER	predigen	Muslime	EPISODIC	_	den #Terror	NEGATIVE	NEGATIVE	_
Muslime QUÄLEN Tiere!	ABUSE	quälen	Muslime	NON_EPISODIC	PERPETRATOR	Tiere	POSITIVE	NEGATIVE	NON-CONFORMISTIC
Schwule schaden dem Fußball.	ABUSE	schaden	Homosexuelle	NON_EPISODIC	PERPETRATOR	dem Fußball	POSITIVE	NEGATIVE	NON-CONFORMISTIC
Koran-Streit - Muslime randalieren in Athen.	OTHER	randalieren	Muslime	EPISODIC	PERPETRATOR	N/A	N/A	N/A	_
Muslime sabotieren unsere freiheitliche Gesellschaft.	ABUSE	sabotieren	Muslime	NON_EPISODIC	PERPETRATOR	unsere freiheitliche Gesellschaft	POSITIVE	NEGATIVE	NON-CONFORMISTIC
Muslime riskieren ihr Leben für Ihre Sicherheit!	OTHER	riskieren	Muslime	NON_EPISODIC	_	ihr Leben	POSITIVE	POSITIVE	_
Muslime rügen Eingriff in ihre Religion.	OTHER	rügen	Muslime	EPISODIC	_	Eingriff in ihre Religion	NEGATIVE	NEGATIVE	_
Muslime schaden uns auch.	ABUSE	schaden	Muslime	NON_EPISODIC	PERPETRATOR	uns	POSITIVE	NEGATIVE	NON-CONFORMISTIC
Schwule ruinieren mit Kreuzfahrten den Staat.	ABUSE	ruinieren	Homosexuelle	NON_EPISODIC	PERPETRATOR	den Staat	POSITIVE	NEGATIVE	NON-CONFORMISTIC
Muslime rügen strukturellen Rassismus.	OTHER	rügen	Muslime	EPISODIC	_	strukturellen Rassismus	NEGATIVE	NEGATIVE	_
Philippinen: Muslime riskieren ihr Leben, um Christen zu retten.	OTHER	riskieren	Muslime	EPISODIC	_	ihr Leben	POSITIVE	POSITIVE	_
Muslime relativieren die Kinderehe.	ABUSE	relativieren	Muslime	NON_EPISODIC	PERPETRATOR	die Kinderehe	NEGATIVE	POSITIVE	NON-CONFORMISTIC
Unser Video des Tages: Muslime randalieren in Paris.	OTHER	randalieren	Muslime	EPISODIC	PERPETRATOR	N/A	N/A	N/A	_
Muslime ruinieren unser Land, unsere Kultur.	ABUSE	ruinieren	Muslime	NON_EPISODIC	PERPETRATOR	unser Land	POSITIVE	NEGATIVE	NON-CONFORMISTIC
Die Juden rauben unsere Frauen.	ABUSE	rauben	Juden	NON_EPISODIC	PERPETRATOR	unsere Frauen	POSITIVE	POSITIVE	_
die Juden raffen das Kapital.	ABUSE	raffen	Juden	NON_EPISODIC	PERPETRATOR	das Kapital	POSITIVE	POSITIVE	_
Die Muslime rechtfertigen Ihre Verbrechen.	ABUSE	rechtfertigen	Muslime	NON_EPISODIC	_	Ihre Verbrechen	NEGATIVE	POSITIVE	NON-CONFORMISTIC
Alle Muslime schaden Deutschland.	ABUSE	schaden	Muslime	NON_EPISODIC	PERPETRATOR	Deutschland	POSITIVE	NEGATIVE	NON-CONFORMISTIC
Juden rügen Beschneidungs-Urteil.	OTHER	rügen	Juden	EPISODIC	_	Beschneidungs-Urteil	NEGATIVE	NEGATIVE	_
SCHWULE SCHADEN DER GESELLSCHAFT	ABUSE	schaden	Homosexuelle	NON_EPISODIC	PERPETRATOR	DER GESELLSCHAFT	POSITIVE	NEGATIVE	NON-CONFORMISTIC
die Muslime rechtfertigen viele Grausamkeiten.	ABUSE	rechtfertigen	Muslime	NON_EPISODIC	_	viele Grausamkeiten	NEGATIVE	POSITIVE	NON-CONFORMISTIC
Muslime schweigen zu islamistischen Terror	OTHER	schweigen	Muslime	EPISODIC	_	N/A	N/A	N/A	_
Muslime schwadronieren über die Verhüllung von Kindern.	ABUSE	schwadronieren	Muslime	NON_EPISODIC	_	die Verhüllung von Kindern	NEGATIVE	POSITIVE	NON-CONFORMISTIC
Die Muslime scheuen wohl LePen.	OTHER	scheuen	Muslime	NON_EPISODIC	_	LePen	NEGATIVE	NEGATIVE	_
Marokko: Muslime schmähen Christen im Internet.	OTHER	schmähen	Muslime	EPISODIC	PERPETRATOR	Christen	POSITIVE	NEGATIVE	NON-CONFORMISTIC
Aber Muslime schmarotzen oft im Unterschied dazu.	ABUSE	schmarotzen	Muslime	NON_EPISODIC	PERPETRATOR	N/A	N/A	N/A	_
Muslime schimpfen über Macron.	OTHER	schimpfen	Muslime	EPISODIC	PERPETRATOR	Macron	POSITIVE	NEGATIVE	NON-CONFORMISTIC
Muslime schweigen zur Minarett-Initiative.	OTHER	schweigen	Muslime	EPISODIC	_	Minarett-Initiative	POSITIVE	POSITIVE	_
Immer mehr Muslime schleichen sich nach Europa!	ABUSE	schleichen	Muslime	NON_EPISODIC	PERPETRATOR	N/A	N/A	N/A	_
Muslime schreien hier laut nach Scharia Recht.	ABUSE	schreien	Muslime	EPISODIC	_	Scharia Recht	NEGATIVE	POSITIVE	NON-CONFORMISTIC
Studie: Muslime schikanieren christliche Asylbewerber in Deutschland.	OTHER	schikanieren	Muslime	NON_EPISODIC	PERPETRATOR	christliche Asylbewerber	POSITIVE	NEGATIVE	NON-CONFORMISTIC
Italien: Muslime schlagen Mädchen mit Kreuzkette.	OTHER	schlagen	Muslime	EPISODIC	PERPETRATOR	Mädchen	POSITIVE	NEGATIVE	NON-CONFORMISTIC
Berlin Potsdamer Platz : Muslime schlagen auf Christen ein.	OTHER	schlagen	Muslime	EPISODIC	PERPETRATOR	Christen	POSITIVE	NEGATIVE	NON-CONFORMISTIC
Muslime schlagen ihre Frauen oder Schwestern	ABUSE	schlagen	Muslime	NON_EPISODIC	PERPETRATOR	ihre Frauen oder Schwestern	POSITIVE	NEGATIVE	NON-CONFORMISTIC
Schwule scheitern mit Anzeigen gegen Bischof Huonder	OTHER	scheitern	Homosexuelle	EPISODIC	_	Anzeigen gegen Bischof Huonder	NEGATIVE	POSITIVE	NON-CONFORMISTIC
Schweiz: Muslime scheitern mit Klage gegen Minarett-Verbot.	OTHER	scheitern	Muslime	EPISODIC	_	Klage gegen Minarett-Verbot	NEGATIVE	POSITIVE	NON-CONFORMISTIC
Muslime schocken mit Vorschriften an Wiener Schulen	OTHER	schocken	Muslime	EPISODIC	PERPETRATOR	N/A	N/A	N/A	_
Muslime schimpfen immer wieder auf den Westen.	ABUSE	schimpfen	Muslime	NON_EPISODIC	PERPETRATOR	den Westen	POSITIVE	NEGATIVE	NON-CONFORMISTIC
die Juden schmarotzen nur mit der Wiedergutmachung.	ABUSE	schmarotzen	Juden	NON_EPISODIC	PERPETRATOR	N/A	N/A	N/A	_
Juden schlittern damit dann in Altersarmut.	OTHER	schlittern	Juden	NON_EPISODIC	_	N/A	N/A	N/A	_
Muslime skandieren Allahu akbar.	OTHER	skandieren	Muslime	EPISODIC	_	Allahu akbar	NEGATIVE	POSITIVE	NON-CONFORMISTIC
Muslime spotten über den IS.	OTHER	spotten	Muslime	EPISODIC	PERPETRATOR	den IS	NEGATIVE	NEGATIVE	_
Muslime skandieren antisemitische Parolen auf Berlins Straßen.	OTHER	skandieren	Muslime	EPISODIC	PERPETRATOR	antisemitische Parolen	NEGATIVE	POSITIVE	NON-CONFORMISTIC
Juden schänden Kirche.	ABUSE	schänden	Juden	EPISODIC	PERPETRATOR	Kirche	POSITIVE	NEGATIVE	NON-CONFORMISTIC
die Muslime spalten bewusst die Gesellschaft mit der Verhüllung der Frau.	ABUSE	spalten	Muslime	NON_EPISODIC	PERPETRATOR	die Gesellschaft	POSITIVE	NEGATIVE	NON-CONFORMISTIC
Muslime spammen Facebook in organisierter Weise.	ABUSE	spammen	Muslime	NON_EPISODIC	PERPETRATOR	Facebook	POSITIVE	NEGATIVE	NON-CONFORMISTIC
Muslime schüren Juden Hass.	ABUSE	schüren	Muslime	NON_EPISODIC	PERPETRATOR	Juden Hass	NEGATIVE	POSITIVE	NON-CONFORMISTIC
Juden schüren die Flammen des Bösen.	ABUSE	schüren	Juden	NON_EPISODIC	PERPETRATOR	die Flammen des Bösen	NEGATIVE	POSITIVE	NON-CONFORMISTIC
die Juden spinnen wohl total!	ABUSE	spinnen	Juden	NON_EPISODIC	_	N/A	N/A	N/A	_
Muslime schänden jüdischen heiligen Ort mit koranischen Ritualen!	ABUSE	schänden	Muslime	EPISODIC	PERPETRATOR	jüdischen heiligen Ort	POSITIVE	NEGATIVE	NON-CONFORMISTIC
Muslime solidarisieren sich mit Attentätern.	OTHER	solidarisieren	Muslime	NON_EPISODIC	PERPETRATOR	Attentätern	NEGATIVE	POSITIVE	NON-CONFORMISTIC
Muslime schänden Kirchen in Deutschland und auf der ganzen Welt.	ABUSE	schänden	Muslime	NON_EPISODIC	PERPETRATOR	Kirchen	POSITIVE	NEGATIVE	NON-CONFORMISTIC
Muslime spinnen Verschwörungstheorien über die Anschläge in Paris	ABUSE	spinne	Muslime	EPISODIC	_	Verschwörungstheorien über die Anschläge in Paris	NEGATIVE	POSITIVE	NON-CONFORMISTIC
Muslime sexualisieren ihre Kinder.	ABUSE	sexualisieren	Muslime	NON_EPISODIC	PERPETRATOR	ihre Kinder	POSITIVE	NEGATIVE	NON-CONFORMISTIC
Juden schänden christliche und muselmanische Gräber.	ABUSE	schänden	Muslime	NON_EPISODIC	PERPETRATOR	christliche und muselmanische Gräber	POSITIVE	NEGATIVE	NON-CONFORMISTIC
Muslime spalten unser Land !	ABUSE	spalten	Muslime	NON_EPISODIC	PERPETRATOR	unser Land	POSITIVE	NEGATIVE	NON-CONFORMISTIC
Muslime solidarisieren sich mit Christen im Irak.	OTHER	solidarisieren	Muslime	EPISODIC	_	Christen im Irak	POSITIVE	POSITIVE	_
Muslime schwänzen Islamkonferenz.	OTHER	schwänzen	Muslime	EPISODIC	_	Islamkonferenz	POSITIVE	NEGATIVE	NON-CONFORMISTIC
Juden stehlen Organe.	ABUSE	stehlen	Juden	NON_EPISODIC	PERPETRATOR	Organe	POSITIVE	POSITIVE	_
Juden sterben in Frankreich.	OTHER	sterben	Juden	EPISODIC	_	N/A	N/A	N/A	_
Muslime sterben bei Krawallen in Kairo.	OTHER	sterben	Muslime	EPISODIC	_	N/A	N/A	N/A	_
Muslime sterben in Deutschland.	OTHER	sterben	Muslime	NON_EPISODIC	_	N/A	N/A	N/A	_
Muslime stehlen gerne!	ABUSE	stehlen	Muslime	NON_EPISODIC	PERPETRATOR	N/A	N/A	N/A	_
Muslime stehlen mehr als 25 Milliarden jedes Jahr alleine aus Harz 4.	ABUSE	stehlen	Muslime	NON_EPISODIC	PERPETRATOR	mehr als 25 Milliarden	POSITIVE	POSITIVE	_
Muslime steinigen den Teufel.	OTHER	steinigen	Muslime	NON_EPISODIC	_	den Teufel	NEGATIVE	NEGATIVE	_
Muslime stinken.	ABUSE	stinken	Muslime	NON_EPISODIC	_	N/A	N/A	N/A	_
Muslime spucken auf unsere Heilige Städte.	ABUSE	spucken	Muslime	NON_EPISODIC	PERPETRATOR	unsere Heilige Städte	POSITIVE	NEGATIVE	NON-CONFORMISTIC
Juden stehlen Kinder.	ABUSE	stehlen	Juden	NON_EPISODIC	PERPETRATOR	Kinder	POSITIVE	POSITIVE	_
Schwule stinken.	ABUSE	stinken	Homosexuelle	NON_EPISODIC	_	N/A	N/A	N/A	_
Juden sprengen islamische Welt in die Luft.	ABUSE	sprengen	Juden	NON_EPISODIC	PERPETRATOR	islamische Welt	POSITIVE	NEGATIVE	NON-CONFORMISTIC
Juden stinken.	ABUSE	stinken	Juden	NON_EPISODIC	_	N/A	N/A	N/A	_
Die Muslime stolzieren seit den Anschlägen v. Paris auf Stuttgarts Straßen.	ABUSE	stolzieren	Muslime	NON_EPISODIC	_	N/A	N/A	N/A	_
Juden sprengen palästinensischen Jungen.	OTHER	sprengen	Juden	EPISODIC	PERPETRATOR	palästinensischen Jungen	POSITIVE	NEGATIVE	NON-CONFORMISTIC
Muslime steinigen gerne.	ABUSE	steinigen	Muslime	NON_EPISODIC	PERPETRATOR	N/A	N/A	N/A	_
Die Muslime steinigen den Teufel in Mekka.	OTHER	steinigen	Muslime	NON_EPISODIC	_	den Teufel	NEGATIVE	NEGATIVE	_
Muslime sprengen Kirchen in die Luft!	ABUSE	sprengen	Muslime	NON_EPISODIC	PERPETRATOR	Kirchen	POSITIVE	NEGATIVE	NON-CONFORMISTIC
Juden steinigen Leute.	ABUSE	steinigen	Juden	NON_EPISODIC	PERPETRATOR	Leute	POSITIVE	NEGATIVE	NON-CONFORMISTIC
Italien: Muslime stören katholischen Prozession mit Beleidigungen und Drohungen.	OTHER	stören	Muslime	EPISODIC	PERPETRATOR	katholischen Prozession	POSITIVE	NEGATIVE	NON-CONFORMISTIC
Muslime stürmen deutsche Botschaft im Sudan	OTHER	stürmen	Muslime	EPISODIC	PERPETRATOR	deutsche Botschaft im Sudan	POSITIVE	NEGATIVE	NON-CONFORMISTIC
Schwule stürmen den Bundestag.	OTHER	stürmen	Homosexuelle	EPISODIC	PERPETRATOR	den Bundestag	POSITIVE	NEGATIVE	NON-CONFORMISTIC
Muslime streiten für einen aufgeklärten #Islam.	OTHER	streiten	Muslime	NON_EPISODIC	_	einen aufgeklärten #Islam	POSITIVE	POSITIVE	_
Muslime stören Weihnachten mit Massenschlägerei.	OTHER	stören	Muslime	EPISODIC	PERPETRATOR	Weihnachten	POSITIVE	NEGATIVE	NON-CONFORMISTIC
Thailand: Muslime stürmen buddhistischen Tempel.	OTHER	stürmen	Muslime	EPISODIC	PERPETRATOR	buddhistischen Tempel	POSITIVE	NEGATIVE	NON-CONFORMISTIC
Juden stören immer die Liebe des germanischen Stammes.	ABUSE	stören	Juden	NON_EPISODIC	PERPETRATOR	die Liebe des germanischen Stammes	NEGATIVE	NEGATIVE	_
Juden "stürmen" noch einen heiligen Ort!	ABUSE	stürmen	Juden	EPISODIC	PERPETRATOR	einen heiligen Ort	POSITIVE	NEGATIVE	NON-CONFORMISTIC
Muslime streiten über Antisemitismus.	OTHER	streiten	Muslime	NON_EPISODIC	_	Antisemitismus	NEGATIVE	NEGATIVE	_
Georgien: Muslime streiten mit Christen um eine Bibliothek.	OTHER	streiten	Muslime	EPISODIC	_	Christen	POSITIVE	NEGATIVE	NON-CONFORMISTIC
Die Muslime stören den Frieden in Europa und auf der ganzen Welt!.	ABUSE	stören	Muslime	NON_EPISODIC	PERPETRATOR	den Frieden	POSITIVE	NEGATIVE	NON-CONFORMISTIC
